{
  "schema_version": 1,
  "event_id": "skills-499-implementation-start-20260923t224133z",
  "issue": "tedeuxx/tadeumendonca-skills#499",
  "timestamp": "2026-09-23T22:41:33Z",
  "event_type": "implementation_start",
  "stage": "build",
  "run_id": "sprint-03-499-build",
  "attempt_id": "initial-build",
  "attribution": {
    "harness": "Codex",
    "runtime_version": "unknown",
    "plugin": {"version": "2.0.77", "source_revision": "6cfe93c1f26564f703c39a14c8aa8c366635f448"},
    "persona": "agents-lead",
    "provenance": "declared"
  },
  "revision": {
    "repository": "tedeuxx/tadeumendonca-skills",
    "branch": "feat/499-worklog-velocity",
    "commit": "6cfe93c1f26564f703c39a14c8aa8c366635f448"
  },
  "evidence": [
    "https://github.com/tedeuxx/tadeumendonca-skills/issues/499",
    "docs/planning/sprint-03.md"
  ],
  "handoff": {"state": "active", "to": null},
  "frozen_estimate": {
    "points": 8,
    "provenance": "agents-lead 8; quality-assurance 8; median 8; owner-confirmed sprint-03 commitment",
    "commitment_points": 8
  }
}
