{
  "schema_version": 1,
  "event_id": "skills-499-resume-plugin-2077-20260923t230719z",
  "issue": "tedeuxx/tadeumendonca-skills#499",
  "timestamp": "2026-09-23T23:07:19Z",
  "event_type": "checkpoint",
  "stage": "build",
  "run_id": "sprint-03-499-build",
  "attempt_id": "resume-after-plugin-refresh",
  "predecessor_event_id": "skills-499-correct-start-plugin-20260923t230719z",
  "resume_of_event_id": "skills-499-implementation-start-20260923t224133z-corrected",
  "attribution": {
    "harness": "Codex",
    "runtime_version": "unknown",
    "plugin": {"version": "2.0.77", "source_revision": "6cfe93c1f26564f703c39a14c8aa8c366635f448"},
    "persona": "agents-lead",
    "provenance": "declared"
  },
  "revision": {
    "repository": "tedeuxx/tadeumendonca-skills",
    "branch": "feat/499-worklog-velocity",
    "commit": "6cfe93c1f26564f703c39a14c8aa8c366635f448"
  },
  "evidence": ["the refreshed 2.0.77 carrier resolved and read-only tool execution succeeded"],
  "handoff": {"state": "active", "to": null}
}
